{
  "$schema": "https://json-schema.org/draft/2020-12/schema",
  "$id": "https://bluedot-ai.example/schemas/behavior-audit/plan-v1.schema.json",
  "title": "Behavior Audit Published Plan v1",
  "type": "object",
  "additionalProperties": false,
  "required": [
    "schema_version",
    "plan_id",
    "version",
    "problem_text",
    "knowledge_points",
    "tests",
    "published_at",
    "content_sha256"
  ],
  "properties": {
    "schema_version": { "const": 1 },
    "plan_id": {
      "type": "string",
      "minLength": 1,
      "maxLength": 128,
      "pattern": "^[A-Za-z0-9][A-Za-z0-9._:-]*$"
    },
    "version": { "type": "integer", "minimum": 1, "maximum": 2147483647 },
    "problem_text": { "type": "string", "minLength": 1, "maxLength": 20000 },
    "knowledge_points": {
      "type": "array",
      "minItems": 1,
      "maxItems": 50,
      "items": {
        "type": "object",
        "additionalProperties": false,
        "required": [
          "knowledge_point_id",
          "name",
          "description",
          "observation_basis"
        ],
        "properties": {
          "knowledge_point_id": {
            "type": "string",
            "minLength": 1,
            "maxLength": 128,
            "pattern": "^[A-Za-z0-9][A-Za-z0-9._:-]*$"
          },
          "name": { "type": "string", "minLength": 1, "maxLength": 120 },
          "description": { "type": "string", "minLength": 1, "maxLength": 2000 },
          "observation_basis": { "type": "string", "minLength": 1, "maxLength": 2000 }
        }
      }
    },
    "tests": {
      "type": "array",
      "maxItems": 100,
      "items": {
        "type": "object",
        "additionalProperties": false,
        "required": ["test_id", "title", "description", "expected_behavior"],
        "properties": {
          "test_id": {
            "type": "string",
            "minLength": 1,
            "maxLength": 128,
            "pattern": "^[A-Za-z0-9][A-Za-z0-9._:-]*$"
          },
          "title": { "type": "string", "minLength": 1, "maxLength": 120 },
          "description": { "type": "string", "minLength": 1, "maxLength": 2000 },
          "expected_behavior": { "type": "string", "minLength": 1, "maxLength": 2000 }
        }
      }
    },
    "published_at": {
      "type": "string",
      "minLength": 20,
      "maxLength": 32,
      "pattern": "^\\d{4}-\\d{2}-\\d{2}T\\d{2}:\\d{2}:\\d{2}(?:\\.\\d{3})?Z$"
    },
    "content_sha256": { "type": "string", "pattern": "^[a-f0-9]{64}$" }
  }
}
